<?xml version="1.0" encoding="UTF-8"?>
<configuration xmlns:xsi="http://www.w3.org/2001/XMLSchema-instance" xsi:noNamespaceSchemaLocation="xsds/appconfig.xsd">

    <connections>

        <dbConnections>
            <dbConnection type="sqlite">
                <url>src/main/resources/files/Patientenverwaltung.db3</url>
            </dbConnection>
        </dbConnections>

        <fileConnections>
            <fileConnection model="patient">
                <file type="xml">src/main/resources/files/patienten.xml</file>
                <file type="csv">src/main/resources/files/patienten.csv</file>
            </fileConnection>
            <fileConnection model="pflegekraft">
                <file type="xml">src/main/resources/files/Pflegekraft.xml</file>
            </fileConnection>
            <fileConnection model="leistung">
                <file type="xml">src/main/resources/files/leistungen.xml</file>
                <file type="csv">src/main/resources/files/Leistungen.csv</file>
            </fileConnection>
        </fileConnections>
    </connections>

    <dataSources>
        <dataSource model="patient" source="db" type="sqlite" />
        <dataSource model="pflegekraft" source="file" type="xml" />
        <dataSource model="leistung" source="file" type="csv" />
    </dataSources>


</configuration>
